date,tokens
2020-06-22,cyber extortion scam january may lead least loss police erp charge gantry jul traffic condition remain optimal postcircuit breaker lta pofma encourage democracy disadvantage opposition shanmugam upcoming general election steroid recommend singapore treatment patient despite major breakthrough uk ntuc fairprice far extend price freeze housebrand product food delivery rider fin rid escooter man outside school china couple accuse obstruct containment work set trial lawyer discharge singapore report new case include case community new licence condition employment agency ensure fair hiring attract singaporean job vacancy doctor get jail lock exgirlfriend room assault refused sex singapore turf club resume race behind closed door jul plan expand mrt network early remains despite delay due khaw boon wan elderly man jail repeatedly kiss hug family maid hsa warns consumer weight loss product contain potent ban ingredient economic activity continue despite risk every person bear individual responsibility say shanmugam arrest fight break bukit batok fine issue far psp member alleged safe distancing breach bukit batok walkabout nea pap mp tan wu meng comment alfian saat politically motivate say wp chief pritam singh national museum singapore asian civilisation museum reopen jun patient hospital allow visitor different household day phase heavy penalty jul household repeat mosquito breeding offence multiple breeding habitat nea sia passenger city china japan south korea transit changi airport cyber extortion case january may lead least loss police hospital prepare spike dengue case amid concern rise number singapore reopen public transport cleaning regime take safety test property firm expect transaction physical viewing resale flat showrooms resume phase reopen emerge strong taskforce identify global risk seize economic opportunity singapore desmond lee commentary record dengue case complicate singapore fight commentary wrangling rest day foreign domestic worker employer face phase singapore police receive report cyber extortion scam january may year total loss add least say singapore police force spf monday jun case typically involve culprit ask victim perform compromise sexual act singapore electronic road pricing erp rate gantry remain zero least jul land transport authority lta say monday jun follow first review rate circuit breaker base lta monitoring traffic condition singapore protection online falsehood manipulation act pofma disadvantage opposition instead encourage great democracy say minister law home affair k shanmugam mr shanmugam speak host diana ser programme conversation sunday dexamethasone first drug improve survival patient team oxford university find widely available inexpensive expert singapore urge caution singapore ntuc fairprice continue freeze price housebrand item supermarket end year part million package alleviate living cost household amid pandemic item include daily essential grocery like rice oil singapore parttime food delivery rider fin monday jun rid electric scooter man outside school muhammad aznurhak abdul azeez way pick delivery domino pizza incident occur plead guilty one singapore married couple china set go trial charge obstruct containment work discharge initial lawyer china national hu jun wife shi sha set go trial aug accord court record charge singapore singapore confirm new case noon monday jun include one case community bring singapore total case community work pas holder ministry health moh say preliminary daily update vast singapore employment agency singapore meet new licence condition strengthen fair hiring practice announce ministry manpower mom monday jun nearly employment agency license mom must way abet discriminatory hiring singapore doctor repeatedly assault exgirlfriend leave facial fracture bleed brain sentence monday jun three year six month two week jail four stroke cane fine clarence teo shun jie locum singapore singapore turf club resume race behind closed door jul receive approval government announce medium release monday jun club resume race strict health safe management measure place singapore enter singapore singapore still stick planned expansion mrt network early although delay affect availability construction worker transport minister khaw boon wan say monday jun plan expand mrt singapore elderly man keep make advance maid hire care newborn family despite turn away repeatedly kiss hug filipino domestic helper man jail four month monday jun name singapore health science authority hsa monday jun issue alert three weight loss product find potent medicinal ingredient two product clinic k ro slim booster contain ban substance sibutramine rozell detox contain singapore singaporean calibrate carry economic activity even though risk high phase singapore reopen say minister law home affair k shanmugam speak host diana ser first three special episode conversation singapore three men arrest fight break bukit batok friday jun night police say receive call assistance blk bukit batok st friday three singaporean men age arrest affray police singapore fine issue far several member progress singapore party psp alleged noncompliance safe management measure national environment agency nea say sunday jun response query cna nea say aware incident singapore worker party wp chief pritam singh sunday night jun say article write people action party pap member parliament tan wu meng politically motivate divide singaporean mr singh first direct response opinion piece dr tan wu singapore national museum asian civilisation museum reopen jun one week commencement second phase singapore reopen indian heritage centre malay heritage centre sun yat sen nanyang memorial hall follow suit jul say national singapore patient ward acute community hospital allow receive five visitor different household day say ministry health moh singapore enter second phase post circuit breaker reopen phase reopen singapore household repeat mosquito breeding offence multiple breeding habitat soon face harsh penalty weekly dengue case report earlier month currently household issue composition sum mosquito breeding detect singapore singapore airline sia silkair scoot passenger fly select city china japan south korea transit changi airport approved city hong kong chongqing guangzhou shanghai china osaka tokyo narita international airport singapore police receive report cyber extortion case january may year total loss add least say singapore police force spf monday jun case typically involve culprit ask victim perform compromise sexual act singapore hospital prepare cope possible spike dengue case coming month data show high number infection number case decline aim continue current preventive effort control spread sufficient ridership train bus increase safeguard commuter coronavirus measure enough programme talk point investigates singapore property agent gear serve home buyer want view showroom resale residential unit person phase singapore post circuit breaker reopen potential buyer unable two month due restriction prompt singapore emerge strong taskforce work quickly identify risk threat sector singapore economy facilitate opportunity business worker say task force cochair desmond lee look happen economy people home could one factor drive record dengue case say assistant professor hannah clapham singapore move phase rule concern fdws rest day may get tricky navigate need ensure enough rest say anju mary paul
2020-06-21,men arrest latenight fight lorong mambong holland village commentary tough time excuse callous retrenchment tan wu meng opinion piece pritam singh serious thoughtful shanmugam make family brand mark launch show support family amid pandemic mosque resume congregational worship jun online booking require singapore report new case ntu student among community case sdp chee soon juan contest bukit batok smc upcoming general election report restaurant order close crowd see along lorong mambong holland village singapore two singaporean men arrest sunday jun fight break holland village friday night police say news release two men age arrest suspected involvement case affray take place lorong mambong economic fallout unprecedented reason retrenchment manage unprecedented level empathy compassion say peoplesearch jaime lim singapore opinion piece write senior parliamentary secretary tan wu meng support apparently offer worker party pritam singh playwright alfian sa serious thoughtful law home affair minister k shanmugam say sunday jun piece dr singapore business organisation community group adopt made family brand mark promote value family singapore initiative national population talent division nptd strategy group prime minister office launch saturday jun singapore mosque resume congregational worship service friday jun online booking require due limit number individual permit per session mosque offer two friday prayer session congregant per session mosque also offer daily singapore singapore confirm new infection noon sunday jun include case community case involve two singaporean one permanent resident three work pas holder four work permit holder say ministry health moh singapore singapore democratic party sdp secretarygeneral dr chee soon juan say sunday jun would contest bukit batok single member constituency smc seat upcoming general election dr chee confirm today walkabout bukit batok singapore british indian curry hut restaurant order close fail ensure safe management practice adhere lead crowd first day phase singapore reopen statement saturday jun urban redevelopment
2020-06-20,prove much one singapore halal mala restaurant commentary show singapore digital art humanity quite essential service business resilience time story picnic company magician corporate training firm commentary month food delivery takeaway teach u industryled group develop execute idea economic growth threemonth sprint singapore must master global trend speed transformation strong economy dpm heng singapore emerge crisis strong society renew sense identity value dpm heng political party resume ground activity phase speculation election grows wet weather see outdoors first saturday phase opt indoor sport arrest drone carry drug spot kranji reservoir park foreign inmate diagnose arrive jan sentence jail jun overstay new infection singapore include community case bring container take backseat eatery amid pandemic commentary ndp uniquely singapore phenomenon people die get restaurant see dinner crowds singapore enters phase reopen worship service may resume people time phase singapore reopen crowds return orchard road long line mall entrance shop reopen month singapore report new case include prison inmate social visit pas picture phase singapore reopen amid pandemic peppercorn owner james tan find challenge time start sell mala soup plan extend lease happen story first cna insider series micro smes beat change drastically coronavirus pandemic thought put digitise archive collection make accessible inclusive say sutd alastair gornall singapore kembangan ms liyana stuart already one earlymorning walk ritual observe daily since start outbreak walk ms liyana buy coffee sometimes grocery back home work may undone singapore zerowaste effort also present opportunity build longlasting habit say project become coco oan ang li singapore seven industryled group develop execute idea key area economic growth within three month late push ensure singapore economy emerge strong crisis deputy prime minister heng swee keat announce televised speech saturday singapore singapore must master major trend reshape global economy speed structural transformation economy emerge strong one deputy prime minister heng swee keat say saturday jun minister speak build singapore singapore emerge crisis strong society renew sense identity value say deputy prime minister heng swee keat saturday jun vow leave singaporean behind mr heng deliver sixth final speech series singapore several political party undertake outreach activity saturday jun speculation grow next general election imminent singapore move phase reopen friday follow twomonth circuit breaker period party singapore addition bring along badminton racquet shuttlecock leisurely game tampines hub court saturday jun mr p shreekant mr gm viswanath make sure pack hand sanitiser well bring sanitisers even though safe singapore four singaporean arrest authority seize drone carry drug kranji reservoir park say singapore police force spf central narcotic bureau cnb joint news release saturday jun accord release police detect singapore foreign inmate social visit pas recently test positive arrive singapore jan sentence jail jun overstay singapore prison service say saturday jun respond cna query sps say singapore singapore confirm new infection noon saturday jun bring country total two community case say ministry health moh preliminary daily update evening update moh say two community case work singapore julia anna deufel go regular coffee haunt bukit timah recently reusable mug allow use surprise store encourages bring byo practice sell mug purpose store offer hold national day parade coronavirus time see debate worth keep mind parade meaningful many singaporean participant say judith silva singapore restaurant fill friday jun first day phase singapore reopen twomonthlong circuit breaker phase announce jun modern european restaurant set date reopen minute singapore congregational worship service may resume jun start people time phase singapore post circuit breaker reopen people include religious support worker although keep minimum say singapore crowd back singapore orchard road shop district friday jun many customer eager make purchase first day retail outlet allow reopen part phase singapore reopen physical shop allow resume business singapore singapore report new case noon friday jun bring national tally one case community prison inmate social visit pas say ministry health moh sri lankan man arrive singapore singapore red tape remove playground public bench shutter shop din diner return eatery hawker centre singapore friday jun saunter phase reopen masked face safedistancing
2020-06-19,commentary get tracetogether download without make mandatory low thia khiang recover steadily say wp chief pritam singh visit singapore business potential target global phishing campaign take advantage pandemic man jail cheat victim unlicensed forex trading wastewater test way singapore tackle pilot launch foreign worker dormitory changi prison inmate test positive asymptomatic link previous case rena lee succeed daren tang chief executive singapore ip office new specie orchid native singapore discover bukit timah reserve singapore pools outlet remain close first weekend phase branch reopen monday slow start f b outlet lunchtime singapore begin phase reopen singaporean may allow enter malaysia without restriction reciprocal arrangement putrajaya potential phishing campaign use fake mom email address support fund ministry patient shed high load virus first week irrespective symptom singapore study pap mp tan wu meng criticise wp leader pritam singh love critic comment happy nt want stay long shopper cautiously return first day phase reopen psp shy away threecornered fight tan cheng bock singaporean fbi wanted list charge falsify invoice conceal trade north korea cocktail bar jekyll hyde reopen team cafe innovative move patient age acute respiratory infection test moh progress singapore party unveils first batch potential candidate general election playgrounds beach reopen start phase tracetogether token face chickenandegg challenge get enough people download wear device say bryan tan singapore former worker party wp chief low thia khiang recover steadily say party current leader pritam singh visit friday jun singapore begin second phase reopen visit mr low home evening see singapore potential global phishing campaign purport help business pandemic singapore reportedly among six country target singapore computer emergency response team singcert say friday jun bogus campaign centre singapore man jail cheat two victim conduct foreign exchange trading without licence say police friday jun ahmadnawar abd karim thursday sentence month jail say police news release singapore singapore expand wastewater test tackle pilot programme launch large foreign worker dormitory country national environment agency national water agency pub home team science technology agency htx say joint news singapore inmate test postive thursday jun asymptomatic link four case report last month singapore prison service sps say friday sps statement come ministry health moh report friday prison inmate singapore mrs rena lee succeed mr daren tang chief executive intellectual property office singapore ipos aug say ministry law friday jun mr tang leave ipos take appointment directorgeneral world intellectual property singapore new specie orchid native endemic singapore discover last year researcher singapore botanic garden specie nervilia singaporensis find july bukit timah nature reserve say national park board nparks news release singapore singapore pool outlet remain close weekend gradually resume operation monday jun toto lottery draw set take place next week singapore pool outlet close since apr country start circuit breaker curb spread singapore two month since people singapore allow dine food beverage establishment around country business ready welcome customer friday jun rush table seat first day singapore singapore singaporean may allow enter malaysia without need undergo screening home quarantine reciprocal arrangement malaysian say putrajaya friday jun speaking press conference measure senior minister singapore hacker may plan potential phishing campaign use spoofed ministry manpower mom email address support fund lure say ministry facebook post friday jun second time week mom warn public phishing singapore patient shed high load novel coronavirus air onto surface first week illness irrespective symptom accord recent singapore study publish national centre infectious disease ncid however possibility singapore senior parliamentary secretary tan wu meng criticise worker party secretarygeneral pritam singh comment make parliament earlier month citizen love critic opinion piece people action party website friday jun dr tan singapore shutter pull dust wipe display counter mall nonessential shop resume business friday jun first day singapore phase post circuit breaker reopen rush people snake queue shopper make singapore progress singapore party psp shy away threecornered fight situation arise say party secretarygeneral tan cheng bock friday jun dr tan add hop good sense would prevail opposition party decide field singapore singaporean manage director u federal bureau investigation fbi wanted list charge falsify invoice two company conceal transaction north korealinked entity tan wee beng manage director commodity partner cheeky along neil road two f b business serve drink burger one space jun singapore start next week age diagnose acute respiratory infection ari test ministry health moh say thursday jun part ministry plan expand test strategy economy reopen singapore progress singapore party psp thursday jun unveil first batch potential candidate upcoming general election include party vice chairman hazel poa national solidarity party well former people voice member brad bowyer singapore playground beach reopen soon singapore enter second phase post circuit breaker transition friday say public service division psd wednesday jun announce list place open public facility public housing
