date,tokens
2020-07-25,singaporean man go nu phd student work chinese intelligence u bed day sgh turn car park isolation ward singaporean pleads guilty u work chinese intelligence prime minister lee hsien loong announces new cabinet watch live pm lee hsien loong announces new cabinet commentary old worker vulnerable rise tide retrenchment ageist mindset persist singapore report new case include community infection national day rally year pm lee make major speech parliament instead nose job facelifts plastic surgeon save body part commentary sandwiched generation kid senior stay home day phase ramada singapore zhongshan park minimart geylang among new location visit case infectious coes available august october hin leong lim family seek halt law firm take court role cabinet reshuffle edwin tong maliki osman promote full minister four new mpselect appoint minister state include former saf general gan siow huang yeo jun wei dickson target u citizen valuable nonpublic information include army officer pentagon civilian work u air force person state department airconditioned single room ensuite toilet wearable biosensors inroom smartphone patient call help singapore general hospital new ward special many way least sit washington singaporean plead guilty friday jul use political consultancy united state front collect information chinese intelligence u justice department say yeo jun wei also know dickson yeo enter plea federal court washington singapore prime minister lee hsien loong announce singapore new cabinet saturday jul day people action party pap take per cent vote general election three office holder retire six office holder promote addition singapore prime minister lee hsien loong announce new cabinet saturday jul facebook post saturday mr lee say announce new cabinet lineup live press conference today press conference broadcast cna website facebook poor attitude old worker ability learn adapt work make expose group economy say suss megan ching singapore singapore report new infection noon saturday jul two case community say ministry health moh bring total number case country community case report saturday work pas holder singapore prime minister lee hsien loong make major speech parliament instead national day rally year outbreak speaking press conference saturday jul unveil new cabinet mr lee respond question parliament work dr pek chong han government hospital go far beyond aesthetic reconstructive plastic surgery patch hole help patient regain function fear catch virus crowded place pass senior home discourages u head say june yong singapore ramada singapore zhongshan park minimart geylang among new location add saturday jul list place visit case community infectious period ramada singapore zhongshan park hotel locate ah hood road singapore certificate entitlement coe quota august october august october say land transport authority lta news release saturday jul drop coes available february april category car singapore member lim family hin leong trading ask court stop law firm rajah tann r work courtappointed supervisor two company embattled oil trading empire evan lim chee meng tell reuters lim sister lim huey ching file singapore cabinet reshuffle announce prime minister lee hsien loong saturday jul saw number promotion six exist officeholder include dr maliki osman mr edwin tong full minister also promote mr zaqy mohamad ms low yen ling associate professor dr singapore four firsttime member parliament mp elect appoint minister state cabinet reshuffle announce saturday jul marymount smc gan siow huang tanjong pagar grc alvin tan pasir rispunggol grc desmond tan east coast grc tan kiat
2020-07-26,need holiday ca nt travel get away stay singapore cabinet reshuffle see lawrence wong appoint minister education ong ye kung helm ministry transport man arrest taxi driver rob woodland leader complete unity behind heng swee keat leadership vivian balakrishnan singapore malaysia settle arrangement crossborder travel aug ready yet daily commute vivian balakrishnan singapore mark birthday amid challenge year first look scaleddown case singapore top new infection arrest dickson yeo jun wei investigation reveal direct threat singapore security say mha newly appoint minister edwin tong step fas vicepresident tekka centre city square mall funan mall among new location visit case infectious lee kuan yew school public policy cancel dickson yeo phd candidature singaporean man go nu phd student work chinese intelligence u singapore seagull fly overhead gaze sea view dot kelongs mangrove island singapore know speed halfcabin cruiser small group four boat tour take u around northeastern coast singapore cruising pulau singapore cabinet reshuffle announce saturday jul prime minister lee hsien loong saw number change key ministerial appointment national development minister lawrence wong take ministry education mr ong ye kung become singapore man arrest follow report taxi driver rob passenger along woodland drive say police sunday jul authority say receive report taxi driver saturday driver singapore fourthgeneration leader ruling people action party pap complete unity behind leadership deputy prime minister heng swee keat foreign affair minister vivian balakrishnan say sunday jul speak reporter woodland immigration singapore singapore malaysia settle arrangement crossborder travel country yet ready allow daily commuting say singapore minister foreign affair vivian balakrishnan dr balakrishnan speak singapore reporter woodland singapore singapore mark year independence challenging year small nation continue fight global pandemic sunday jul demonstration hold padang preview year national day parade ndp small affair focus singapore singapore report new case noon sunday jul include five infection community bring total number case country community case work pas holder say ministry health moh also four singapore ministry home affair mha say sunday jul inform u authority arrest dickson yeo jun wei november last year investigation reveal direct threat singapore security say ministry response medium singapore newlypromoted minister edwin tong resign vicepresident football association singapore fa follow appointment minister culture community youth statement sunday jul fa say mr tong decision relate cabinet appointment singapore tekka centre little india city square mall funan mall among new location add sunday jul list place visit case community infectious period pioneer mall jurong west mustafa centre also among new singapore national university singapore lee kuan yew school public policy lkyspp terminate phd candidature dickson yeo jun wei immediate effect spokesperson school say sunday jul respond cna query spokesperson say statement yeo jun wei dickson target u citizen valuable nonpublic information include army officer pentagon civilian work u air force person state department
2020-07-27,commentary shape singapore cabinet lineup investment company director fin declare incorrect director fee tax return man jail write judge abusive email call beast unfit human man jail set fire singapore flag ignite flame flag hdb block new infection report singapore include imported case man get probation use criminal force exgirlfriend companion polytechnic graduation ceremony entertainment lawyer samuel seow plead guilty abuse employee niece former actor trial strike worker metal scraper say victim act exaggerated pain south korea suspect traveller test positive infect transit singapore new zealand man jail cheat victim pay face mask singapore scientist develop test method delivers result minute new office holder bring fresh idea perspective say pm lee swearingin new cabinet president halimah yacob urge singaporean unite behind newly elect government man jail year raping sexually assault daughter knifepoint horrific case singapore china express commitment keep supply chain trade line open amid gic annualised real return drop cautious stance remain amid global uncertainty assyakirin mosque queensway shop centre among new location visit case infectious period medical expertise health manpower ministry couple experience communication engagementrelated ministry address perception gap government management coronavirus pandemic say gillian koh singapore investment company control director fin order pay penalty declare incorrect expense director fee corporate income tax return year tan hwa luck charge give incorrect information without singapore man come court settle divorce serve six week jail write abusive email judge handle case call beast unfit human among insult lim teck leng give jail term monday jul convict singapore man set fire singapore flag heavily intoxicate spark flame seven flag block jail week monday jul elson ong yong liang give jail term two month short prosecution ask singapore singapore report new case noon monday jul include imported case two infection community bring total number case country two case community one singaporean one work pas singapore graduation ceremony polytechnic student turn ugly another man turn meet graduate exgirlfriend escalate scuffle two men later join assault victim sustain swollen lip bleeding eyelid multiple bruise one singapore entertainment lawyer samuel seow theng beng plead guilty use criminal force hurt two employee incident occur two year ago go viral footage post online seow owner law firm samuel seow law corporation plead singapore former actor claim trial monday jul attack bangladeshi worker metal scraper singapore islamic hub claim victim ask discipline exaggerate pain ng aik leong well know huang yiliang unrepresented defend singapore south korean authority inform new zealand suspect traveller test positive infect transit singapore airport new zealand ministry health say monday jul traveller leave new zealand jul arrive singapore one first men charge mask scam proliferate pandemic sentence three year two month jail monday jul daryl cheong zhi yong admit cheat eight victim surgical face singapore scientist nanyang technological university ntu discover way improve speed obtain test result four time improved testing method yield result minute quarter time require exist gold singapore new political office holder bring fresh idea perspective singaporean confident team say prime minister lee hsien loong monday jul swearingin ceremony thirtythree office holder swear two location singapore president halimah yacob ask singaporean unite behind newly elect government give full support see country though crisis speaking swearingin ceremony new office holder istana monday jul madam halimah say singapore rap daughter twice day subject horrific sustain sexual assault knifepoint man sentence monday jul year jail man earlier find guilty nine charge include two count aggravated rape singapore singapore china express commitment keep global supply chain trade line open amid pandemic say ministry trade industry mti news release monday jul video conference earlier day minister trade singapore singapore sovereign wealth fund gic post drop return last financial year warn challenge global economic outlook amid pandemic year end mar gic annualised real rate return come per cent per singapore mosque shopping centre hawker centre among new location add monday jul list place visit case community infectious period location include assyakirin mosque jurong queensway shopping centre kampung
2020-07-28,revoke capital market service licence financial institution apical asset management man admit remove mask cough sheng siong crowd controller prosecutor seek month jail baby boy find tai keng garden night police investigate grandmother jail make maid slap drench water pritam singh accord additional parliamentary privilege double allowance leader opposition charge allegedly shove grab neck nea officer catch smoke singapore report new case include imported infection man admit stab wife death suspect affair tour singapore take people participant divide subgroup number baby bear singapore rise slightly low grab applies impose platform fee ride competition watchdog seek public feedback maserati driver bar drive life jail four year drag police officer escape bid least singaporean fall victim transnational credit card fraud suspect arrest hong kong police marriage divorce singapore last year face mask create equal thing consider protect dickson yeo china aware case say u stop use espionage issue smear picture singapore swears cabinet political office holder commentary new ministry sustainability environment look pretty promise pritam singh allocate leader opposition remuneration lowincome resident cause singapore monetary authority singapore revoke capital market service licence apical asset management aampl tuesday jul revocation company license due serious breach antimoney launderingcountering financing terrorism aml singapore irk crowd controller withdraw cash atm machine outside supermarket man remove mask intentionally cough tan shiaw wee plead guilty tuesday jul one charge use abusive behaviour victim cough singapore baby boy find tai keng garden near upper paya lebar road monday night jul say police police alert discovery baby around visible injury baby condition stable police add paramedic singapore unhappy household three domestic worker perform chore satisfaction grandmother make slap pour water head three count voluntarily cause hurt maid another two charge take consideration singapore worker party secretarygeneral pritam singh take duty accord additional privilege role leader opposition authority say tuesday jul statement lay detail new post also receive double allowance singapore man charge wednesday jul allegedly shove national environment agency nea enforcement officer grab neck altercation april police say news release tuesday respond call assistance singapore singapore report new case noon tuesday jul include two import case one community bring total number case country community case work pas holder import case place singapore believing wife affair man stab multiple time shower strangle leave naked body bed daughter later find krishnan raju man suffer delusional disorder plead guilty singapore local tour run operator tourist guide big group long safe distancing measure place subgroup participant singapore tourism board stb say tuesday jul tour involve transport bus take people singapore number baby bear singapore rise slightly eightyear low accord data release immigration checkpoint authority ica tuesday jul total baby bear last year per cent increase accord singapore ridehailing firm grab apply implement platform fee gst ride help cover cost competition consumer commission singapore cccs say tuesday jul grab submit platform fee per ride enable grab singapore drag traffic police officer car escape bid maserati driver tuesday jul sentence lifetime disqualification drive top four year seven month prison fine lee cheng yan convict singapore least singaporean become target online credit card fraud syndicate believe operate hong kong say singapore police force spf tuesday jul syndicate allegedly use detail steal credit card holder singapore use phishing singapore couple singapore get married marriage end divorce last year singapore department statistic singstat say tuesday jul total marriage register per cent low marriage register cheap others expensive also say kill viruses much protection various face mask really offer coronavirus programme talk point investigates beijing china monday jul say aware case involve singaporean dickson yeo urge united state stop use socalled espionage issue smear country yeo plead guilty last week u work chinese intelligence former national singapore usual time would stand shouldertoshoulder istana staircase monday even jul member singapore new cabinet stand arm length front entrance step pose family photo part safedistancing measure rebranding ministry timely acknowledge new challenge generation say energy study institute melissa low singapore worker party wp secretarygeneral pritam singh detail tuesday jul would allocate half allowance leader opposition towards help lowincome resident various need party cause earlier day authority announce
2020-07-29,depress father jail kill daughter try commit suicide local bank cap dividend offer shareholder alternative conserve capital singapore airline report billion net loss hit demand importer fin illegally bring food product unauthorised disposal foreign worker dormitory clear singapore report new case community infection union halt unfair retrenchment aerospace firm industrial action avert woman arrest newborn baby find recycle bin residential estate exauxiliary police officer jail cull crow shotgun without safety officer present leader opposition turning point also doubleedged sword say analyst face verification technology allow singpass holder sign dbs digital banking service use selfie job attachment available midcareer jobseekers new sgunited programme li shengwu find guilty contempt court fin week jail pay singapore jobless rate hit high decade retrenchment double pm lee fear uschina tension may continue past upcoming u presidential election singapore clinically depressed divorce looming head man kill twoyearold daughter want take death man name due gag order impose court sentence wednesday jul six year jail singapore monetary authority singapore advise local bank cap dividend call preemptive move bolster bank resilience ability support lend current economic downturn medium release wednesday jul say singapore singapore airline sia wednesday jul report billion net loss first quarter drastically cut capacity due travel restriction amid pandemic compare million profit period year ago revenue singapore importer fin total wednesday jul illegally import food product dispose without authorisation sunrise vegetable fin illegally import fresh fruit vegetable process food malaysia singapore ninetyfive foreign worker dormitory clear take total number dormitory clear say ministry manpower mom statement wednesday jul newly clear facility include one purposebuilt dormitory factory singapore singapore report new case noon wednesday jul three infection community ministry health moh say preliminary update bring total number case singapore among community infection two singapore retrenchment exercise eagle service asia esa halt aerospace aviation union find aircraft maintenance repair overhaul mro firm follow due process let go worker process legal industrial action singapore indonesian woman arrest wednesday jul allegedly abandon newborn baby inside recycle bin private residential estate near upper payar lebar road woman believe baby mother police say news release wednesday singapore serve auxiliary police officer man discharge shotgun cull crow without safety officer present cause multiple shotgun pellet lodge wall flat one count rash act endanger personal safety eric kow jail four singapore appointment leader opposition significant move whether change singapore political system substance remains see analyst tell cna office also help government manage pace political change singapore say one singapore singpass holder able sign db digital banking service take picture use face verification technology follow rise digital banking amid pandemic pilot programme aim benefit million db singapore august local midcareer jobseekers able apply attachment company across multiple industry new career pathway programme say ministry manpower mom workforce singapore wsg wednesday jul sgunited mid singapore mr li shengwu grandson lee kuan yew son lee hsien yang find guilty contempt court fin pay fine within two week serve week jail default say justice kannan ramesh verdict wednesday jul singapore singapore overall unemployment rate rise second quarter high level decade retrenchment double total employment decline amid pandemic overall unemployment rate rise per cent per cent precede singapore prime minister lee hsien loong tuesday jul say fear uschina tension could continue beyond u presidential election year highlight bipartisan consensus treat china threat mr lee speak virtual dialogue organise atlantic
2020-07-30,ndp even show showcase experience singaporean crisis first week august expect warm temperature met service man fin unregistered health product include pill condom sale million recover police antiscam centre first year operation target extension job support scheme would help cope loss analyst mother charge abandon child rubbish bin singapore report new case community infection town council form include new sengkang town council mnd take grant singapore remain aviation hub ong ye kung uber revers course keep asiapacific headquarters singapore least end pritam singh clarify allowance increase set aside lowincome resident cause singapore malaysia hold ceremony causeway mark resumption rts link project mother accuse kill daughter burn corpse sob court remand singapore extends u swap facility u feed march china polarise new security law sunset hong kong return stability restaurant noshows rise singapore f b scene struggle pandemic commentary wear mask properly uncover reason behind public mask sham commentary grab new platform fee may raise eyebrow nothing ordinary hillion mall bukit panjang integrate transport hub among new location visit case infectious period restriction ease wedding funeral aug people allow attend singapore experience everyday singaporean cop ongoing pandemic centre evening show year national day parade ndp aug broadcast live star perform art centre much small live audience people singapore first two week august expect warm dry july meteorological service singapore ms say weather outlook thursday jul period daily temperature forecast range degree celsius degree celsius singapore man fin thursday jul unregistered health product include condom contraceptive pill medical device sale pay fine serve day jail song bowen plead guilty count singapore police recover million scam case since antiscam centre start operation year ago figure per cent amount scammer attempt cheat victim case handle centre say police thursday jul singapore government consider extend job support scheme j beyond august take targeted approach help struggle company lowerincome worker analyst interview cna say j government cofunds per cent per cent singapore woman charge thursday jul abandon child rubbish bin indonesian national name due gag order impose court prevent publication identity child identity accuse leave boy singapore singapore report new case noon thursday jul four infection community ministry health moh say preliminary update take national tally among community infection work pas holder one singapore seventeen town council include new sengkang town council form follow general election town council oct handover say ministry national development mnd thursday jul town council one singapore minister transport ong ye kung warn singapore take grant remain aviation hub even pandemic end mr ong speak reporter thursday jul attend ceremony causeway mark official singapore ridehailing company uber reverse decision move asiapacific headquarters singapore stay put country least end company say two month ago plan relocate asiapacific headquarters hong kong singapore worker party wp chief pritam singh clarify donate half additional allowance get leader opposition lo tuesday announce leader opposition singapore receive double allowance elected member passenger service slat start singapore woman accuse murder daughter burn corpse metal barrel sob court remand far investigation foo li ping stand charge murder daughter megan khung yu wai sometime february year suite singapore singapore central bank u federal reserve extend u billion swap facility march bolster u dollar lend firm country region monetary authority singapore mas say thursday jul swap facility allow mas new reality hongkongers beijing power override semiautonomous region local law crack various political crime programme insight examine future hold financial hub many diner make several booking per night choose one cancel rest last minute say restaurant chef end tether singapore tight culture people expect rule follow worth remember wear mask least show care say suss brandon koh consumer might even notice difference worth understand price dynamic grab change year say li jianggan singapore bukit panjang integrate transport hub hillion mall connect among new location add thursday jul list place visit case infectious period four outlet within shopping mall briyani house mcdonald watson singapore restriction number people allow two key life event wedding wakesfunerals far ease aug subject safe distancing measure news release thursday jul ministry health moh say multiministry
